{
  "schemaVersion": 1,
  "corpusVersion": "mechanisms-2",
  "fixtureRevision": "mechanisms-fixture-2",
  "metadata": {
    "totalCases": 17,
    "expectedHotReload": 14,
    "expectedRebuild": 3,
    "authoringErrors": 0,
    "multiFileOperations": 0,
    "smokeHotCases": 14
  },
  "cases": [
    {
      "id": "protocol-default",
      "workload": "MechanismApp",
      "category": "protocol-default-implementation",
      "validity": "valid",
      "expectedLane": "hot-reload",
      "confirmationPolicy": "interposed-function",
      "oracle": {
        "case": "protocol-default",
        "value": "protocol-01-edited"
      },
      "smoke": true,
      "mutation": "mutations/protocol-default.patch",
      "baselineHashes": {
        "MechanismApp/MechanismCoverageScreen.swift": "edf1a607298b7bcc0e89974062dbfa03943a55faf0326e55dec69c90e929a883"
      }
    },
    {
      "id": "actor-method",
      "workload": "MechanismApp",
      "category": "actor-implementation",
      "validity": "valid",
      "expectedLane": "hot-reload",
      "confirmationPolicy": "interposed-function",
      "oracle": {
        "case": "actor-method",
        "value": "actor-01-edited"
      },
      "smoke": true,
      "mutation": "mutations/actor-method.patch",
      "baselineHashes": {
        "MechanismApp/MechanismCoverageScreen.swift": "edf1a607298b7bcc0e89974062dbfa03943a55faf0326e55dec69c90e929a883"
      }
    },
    {
      "id": "extension-view-body",
      "workload": "MechanismApp",
      "category": "extension-view-body",
      "validity": "valid",
      "expectedLane": "hot-reload",
      "confirmationPolicy": "interposed-function",
      "oracle": {
        "case": "extension-view-body",
        "value": "extension-01-edited"
      },
      "smoke": true,
      "mutation": "mutations/extension-view-body.patch",
      "baselineHashes": {
        "MechanismApp/MechanismCoverageScreen.swift": "edf1a607298b7bcc0e89974062dbfa03943a55faf0326e55dec69c90e929a883"
      }
    },
    {
      "id": "modifier-body",
      "workload": "MechanismApp",
      "category": "view-modifier-body",
      "validity": "valid",
      "expectedLane": "hot-reload",
      "confirmationPolicy": "interposed-function",
      "oracle": {
        "case": "modifier-body",
        "value": "modifier-01-edited"
      },
      "smoke": true,
      "mutation": "mutations/modifier-body.patch",
      "baselineHashes": {
        "MechanismApp/MechanismCoverageScreen.swift": "edf1a607298b7bcc0e89974062dbfa03943a55faf0326e55dec69c90e929a883"
      }
    },
    {
      "id": "observation-computed",
      "workload": "MechanismApp",
      "category": "observation-computed-property",
      "validity": "valid",
      "expectedLane": "hot-reload",
      "confirmationPolicy": "interposed-function",
      "oracle": {
        "case": "observation-computed",
        "value": "observation-01-edited"
      },
      "smoke": true,
      "mutation": "mutations/observation-computed.patch",
      "baselineHashes": {
        "MechanismApp/MechanismCoverageScreen.swift": "edf1a607298b7bcc0e89974062dbfa03943a55faf0326e55dec69c90e929a883"
      }
    },
    {
      "id": "property-wrapper-getter",
      "workload": "MechanismApp",
      "category": "property-wrapper-body",
      "validity": "valid",
      "expectedLane": "hot-reload",
      "confirmationPolicy": "interposed-function",
      "oracle": {
        "case": "property-wrapper-getter",
        "value": "wrapper-01-edited"
      },
      "smoke": true,
      "mutation": "mutations/property-wrapper-getter.patch",
      "baselineHashes": {
        "MechanismApp/MechanismCoverageScreen.swift": "edf1a607298b7bcc0e89974062dbfa03943a55faf0326e55dec69c90e929a883"
      }
    },
    {
      "id": "parameterized-helper",
      "workload": "MechanismApp",
      "category": "parameterized-function",
      "validity": "valid",
      "expectedLane": "hot-reload",
      "confirmationPolicy": "interposed-function",
      "oracle": {
        "case": "parameterized-helper",
        "value": "parameter-01-edited"
      },
      "smoke": true,
      "mutation": "mutations/parameterized-helper.patch",
      "baselineHashes": {
        "MechanismApp/MechanismCoverageScreen.swift": "edf1a607298b7bcc0e89974062dbfa03943a55faf0326e55dec69c90e929a883"
      }
    },
    {
      "id": "initializer-body",
      "workload": "MechanismApp",
      "category": "initializer-body",
      "validity": "valid",
      "expectedLane": "hot-reload",
      "confirmationPolicy": "interposed-function",
      "oracle": {
        "case": "initializer-body",
        "value": "initializer-01-edited"
      },
      "smoke": true,
      "mutation": "mutations/initializer-body.patch",
      "baselineHashes": {
        "MechanismApp/MechanismCoverageScreen.swift": "edf1a607298b7bcc0e89974062dbfa03943a55faf0326e55dec69c90e929a883"
      }
    },
    {
      "id": "accessor-getter",
      "workload": "MechanismApp",
      "category": "accessor-getter",
      "validity": "valid",
      "expectedLane": "hot-reload",
      "confirmationPolicy": "interposed-function",
      "oracle": {
        "case": "accessor-getter",
        "value": "accessor-01-edited"
      },
      "smoke": true,
      "mutation": "mutations/accessor-getter.patch",
      "baselineHashes": {
        "MechanismApp/MechanismCoverageScreen.swift": "edf1a607298b7bcc0e89974062dbfa03943a55faf0326e55dec69c90e929a883"
      }
    },
    {
      "id": "subscript-body",
      "workload": "MechanismApp",
      "category": "subscript-body",
      "validity": "valid",
      "expectedLane": "hot-reload",
      "confirmationPolicy": "interposed-function",
      "oracle": {
        "case": "subscript-body",
        "value": "subscript-01-edited"
      },
      "smoke": true,
      "mutation": "mutations/subscript-body.patch",
      "baselineHashes": {
        "MechanismApp/MechanismCoverageScreen.swift": "edf1a607298b7bcc0e89974062dbfa03943a55faf0326e55dec69c90e929a883"
      }
    },
    {
      "id": "generic-helper",
      "workload": "MechanismApp",
      "category": "generic-function",
      "validity": "valid",
      "expectedLane": "hot-reload",
      "confirmationPolicy": "interposed-function",
      "oracle": {
        "case": "generic-helper",
        "value": "generic-01-edited"
      },
      "smoke": true,
      "mutation": "mutations/generic-helper.patch",
      "baselineHashes": {
        "MechanismApp/MechanismCoverageScreen.swift": "edf1a607298b7bcc0e89974062dbfa03943a55faf0326e55dec69c90e929a883"
      }
    },
    {
      "id": "async-parameterized",
      "workload": "MechanismApp",
      "category": "async-parameterized-function",
      "validity": "valid",
      "expectedLane": "hot-reload",
      "confirmationPolicy": "interposed-function",
      "oracle": {
        "case": "async-parameterized",
        "value": "async-01-edited"
      },
      "smoke": true,
      "mutation": "mutations/async-parameterized.patch",
      "baselineHashes": {
        "MechanismApp/MechanismCoverageScreen.swift": "edf1a607298b7bcc0e89974062dbfa03943a55faf0326e55dec69c90e929a883"
      }
    },
    {
      "id": "uikit-display-value",
      "workload": "MechanismApp",
      "category": "uikit-bridge-configuration",
      "validity": "valid",
      "expectedLane": "hot-reload",
      "confirmationPolicy": "interposed-function",
      "oracle": {
        "case": "uikit-display-value",
        "value": "uikit-display-01-edited"
      },
      "smoke": true,
      "mutation": "mutations/uikit-display-value.patch",
      "baselineHashes": {
        "MechanismApp/MechanismCoverageScreen.swift": "edf1a607298b7bcc0e89974062dbfa03943a55faf0326e55dec69c90e929a883"
      }
    },
    {
      "id": "uikit-update-view",
      "workload": "MechanismApp",
      "category": "uikit-update-implementation",
      "validity": "valid",
      "expectedLane": "hot-reload",
      "confirmationPolicy": "interposed-function",
      "oracle": {
        "case": "uikit-update-view",
        "value": "uikit-update-01-edited"
      },
      "smoke": true,
      "mutation": "mutations/uikit-update-view.patch",
      "baselineHashes": {
        "MechanismApp/MechanismCoverageScreen.swift": "edf1a607298b7bcc0e89974062dbfa03943a55faf0326e55dec69c90e929a883"
      }
    },
    {
      "id": "mechanism-stored-property",
      "workload": "MechanismApp",
      "category": "stored-property",
      "validity": "valid",
      "expectedLane": "build-device",
      "mutation": "mutations/mechanism-stored-property.patch",
      "baselineHashes": {
        "MechanismApp/MechanismCoverageScreen.swift": "edf1a607298b7bcc0e89974062dbfa03943a55faf0326e55dec69c90e929a883"
      }
    },
    {
      "id": "mechanism-signature",
      "workload": "MechanismApp",
      "category": "signature-change",
      "validity": "valid",
      "expectedLane": "build-device",
      "mutation": "mutations/mechanism-signature.patch",
      "baselineHashes": {
        "MechanismApp/MechanismCoverageScreen.swift": "edf1a607298b7bcc0e89974062dbfa03943a55faf0326e55dec69c90e929a883"
      }
    },
    {
      "id": "mechanism-import",
      "workload": "MechanismApp",
      "category": "import-change",
      "validity": "valid",
      "expectedLane": "build-device",
      "mutation": "mutations/mechanism-import.patch",
      "baselineHashes": {
        "MechanismApp/MechanismCoverageScreen.swift": "edf1a607298b7bcc0e89974062dbfa03943a55faf0326e55dec69c90e929a883"
      }
    }
  ]
}
